{
  "schema_version": "2.0",
  "artifact_type": "human_tasks",
  "project_id": "coar-demo",
  "created_at": "2026-07-14T12:00:00Z",
  "updated_at": "2026-07-14T12:00:00Z",
  "extensions": {},
  "tasks": [
    {
      "task_id": "HT-0001",
      "status": "open",
      "question": "Optionally provide a preferred example dataset.",
      "why_useful": "It may improve ecological validity but does not block the current benchmark work.",
      "created_at": "2026-07-14T12:00:00Z",
      "source_trial_id": "000001_test-main-signal"
    }
  ],
  "blocking_tasks_allowed": false
}
